{
  "nicheSlug": "edl-printable-designs",
  "searchPhrase": "https://www.etsy.com/in-en/shop/EdLPrintableDesigns",
  "fetchedAt": "2026-08-07T04:22:49.361826+00:00",
  "items": [
    {
      "index": 1,
      "title": "Gingham Bow Clipart, Plaid Coquette Ribbons, Checkered Nursery Art (Digital Download)",
      "listingUrl": "https://www.etsy.com/in-en/listing/1872897364/gingham-bow-clip-art-checkered-ribbon",
      "imageUrl": "https://i.etsystatic.com/40718390/r/il/9b4e45/6757806605/il_340x270.6757806605_ny5f.jpg",
      "localPath": "data/research/refs/edl-printable-designs/01.jpg"
    },
    {
      "index": 2,
      "title": "Vintage Church Clip Art, Watercolor Chapel, Christian Scrapbook Paper (JPG Set)",
      "listingUrl": "https://www.etsy.com/in-en/listing/1844007924/vintage-church-clip-art-watercolor",
      "imageUrl": "https://i.etsystatic.com/40718390/r/il/6ccf94/6613931883/il_340x270.6613931883_4rj1.jpg",
      "localPath": "data/research/refs/edl-printable-designs/02.jpg"
    },
    {
      "index": 3,
      "title": "Christmas Digital Paper, Xmas Printable Background, New Year Seamless Pattern (Digital Download)",
      "listingUrl": "https://www.etsy.com/in-en/listing/1564043000/christmas-digital-paper-pack-red-green",
      "imageUrl": "https://i.etsystatic.com/40718390/r/il/e0444a/5396428059/il_340x270.5396428059_qqw5.jpg",
      "localPath": "data/research/refs/edl-printable-designs/03.jpg"
    },
    {
      "index": 4,
      "title": "Christmas Digital Paper Pack, Seamless Red Green Patterns (Digital Download)",
      "listingUrl": "https://www.etsy.com/in-en/listing/1567394916/christmas-digital-paper-pack-seamless",
      "imageUrl": "https://i.etsystatic.com/40718390/r/il/e91c74/5412923617/il_340x270.5412923617_2he0.jpg",
      "localPath": "data/research/refs/edl-printable-designs/04.jpg"
    },
    {
      "index": 5,
      "title": "Gingham Flowers Digital Paper, Summer Floral Scrapbook, Kitchen Print Pattern (Digital Download)",
      "listingUrl": "https://www.etsy.com/in-en/listing/1430456106/gingham-flowers-digital-paper-12x12",
      "imageUrl": "https://i.etsystatic.com/40718390/r/il/d8dff9/5449119608/il_340x270.5449119608_2rmp.jpg",
      "localPath": "data/research/refs/edl-printable-designs/05.jpg"
    },
    {
      "index": 6,
      "title": "Baking and Bakery PNG Clipart, Kitchen Tool, Kitchen Supplies, Food Illustration Scrapbook (Digital Download)",
      "listingUrl": "https://www.etsy.com/in-en/listing/4530475854/baking-and-bakery-png-clipart-kitchen",
      "imageUrl": "https://i.etsystatic.com/40718390/r/il/adc5ba/8196658894/il_340x270.8196658894_q0a0.jpg",
      "localPath": "data/research/refs/edl-printable-designs/06.jpg"
    },
    {
      "index": 7,
      "title": "Construction PNG Clipart, Printable Builder Trucks Image, Birthday Party Excavator Scrapbook (Digital Download)",
      "listingUrl": "https://www.etsy.com/in-en/listing/4537261291/cute-construction-png-clipart-printable",
      "imageUrl": "https://i.etsystatic.com/40718390/r/il/78bf16/8295637755/il_340x270.8295637755_qmqw.jpg",
      "localPath": "data/research/refs/edl-printable-designs/07.jpg"
    },
    {
      "index": 8,
      "title": "Floral Watercolor Bookshelf Clip Art, Old Books, Scrapbook (JPG Digital Download)",
      "listingUrl": "https://www.etsy.com/in-en/listing/1861340699/floral-watercolor-bookshelf-clip-art-old",
      "imageUrl": "https://i.etsystatic.com/40718390/r/il/b4a426/6580632544/il_340x270.6580632544_aisp.jpg",
      "localPath": "data/research/refs/edl-printable-designs/08.jpg"
    },
    {
      "index": 9,
      "title": "Vintage Travel Adventure PNG Clipart, Wanderlust Printable Image, Tourism Element, Vacation Scrapbook (Digital Download)",
      "listingUrl": "https://www.etsy.com/in-en/listing/4513295029/vintage-travel-adventure-png-clipart",
      "imageUrl": "https://i.etsystatic.com/40718390/r/il/b514a5/8123510407/il_340x270.8123510407_qxut.jpg",
      "localPath": "data/research/refs/edl-printable-designs/09.jpg"
    },
    {
      "index": 10,
      "title": "Autumn Landscape Clipart, Cozy Fall Scenery, Watercolor Nature Paper Bundle (Digital Download)",
      "listingUrl": "https://www.etsy.com/in-en/listing/1807840924/autumn-landscape-clip-art-cozy-fall",
      "imageUrl": "https://i.etsystatic.com/40718390/r/il/3bfa42/6458689055/il_340x270.6458689055_eh37.jpg",
      "localPath": "data/research/refs/edl-printable-designs/10.jpg"
    },
    {
      "index": 11,
      "title": "Watercolor Baby Moose Clip Art, Floral Woodland Animals (JPG Digital Download)",
      "listingUrl": "https://www.etsy.com/in-en/listing/1828371610/watercolor-baby-moose-clip-art-floral",
      "imageUrl": "https://i.etsystatic.com/40718390/r/il/8ecf70/6550257707/il_340x270.6550257707_t1qh.jpg",
      "localPath": "data/research/refs/edl-printable-designs/11.jpg"
    },
    {
      "index": 12,
      "title": "Love Word Digital Papers, Valentines Day Scrapbook, Hearts Seamless Patterns (Digital Download)",
      "listingUrl": "https://www.etsy.com/in-en/listing/1639745452/love-word-digital-paper-pack-hearts",
      "imageUrl": "https://i.etsystatic.com/40718390/r/il/4e1057/5657480186/il_340x270.5657480186_jabp.jpg",
      "localPath": "data/research/refs/edl-printable-designs/12.jpg"
    }
  ]
}